Title,URL,Description,Details,ShortDetails,Resource,Type,Identifiers,Db,EntrezUID,Properties
"Health costs of post-operative complications following rectal resection: a systematic review.","/pubmed/32053858","Johnston S, Louis M, Churilov L, Ma R, Christophi C, Weinberg L.","ANZ J Surg. 2020 Feb 13. doi: 10.1111/ans.15708. [Epub ahead of print] Review.","ANZ J Surg.  2020","PubMed","citation","PMID:32053858","pubmed","32053858","create date:2020/02/14 | first author:Johnston S",
"The interaction of valine and glucose and the influence on the spectrin-actin complex in sickle cell disease.","/pubmed/32053762","Purnell MC.","Discov Med. 2019 Nov-Dec;28(155):219-227.","Discov Med.  2019","PubMed","citation","PMID:32053762","pubmed","32053762","create date:2020/02/14 | first author:Purnell MC",
"Food consumption by degree of processing and cardiometabolic risk: a systematic review.","/pubmed/32053758","Silva Meneguelli T, Viana Hinkelmann J, Hermsdorff HHM, Zulet MÁ, Martínez JA, Bressan J.","Int J Food Sci Nutr. 2020 Feb 13:1-15. doi: 10.1080/09637486.2020.1725961. [Epub ahead of print]","Int J Food Sci Nutr.  2020","PubMed","citation","PMID:32053758","pubmed","32053758","create date:2020/02/14 | first author:Silva Meneguelli T",
"The Impact of Skeletal Muscle ERα on Mitochondrial Function and Metabolic Health.","/pubmed/32053721","Hevener AL, Ribas V, Moore TM, Zhou Z.","Endocrinology. 2020 Feb 1;161(2). pii: bqz017. doi: 10.1210/endocr/bqz017.","Endocrinology.  2020","PubMed","citation","PMID:32053721","pubmed","32053721","create date:2020/02/14 | first author:Hevener AL",
"The impacts of unstructured nature play on health in early childhood development: A systematic review.","/pubmed/32053683","Dankiw KA, Tsiros MD, Baldock KL, Kumar S.","PLoS One. 2020 Feb 13;15(2):e0229006. doi: 10.1371/journal.pone.0229006. eCollection 2020.","PLoS One.  2020","PubMed","citation","PMID:32053683","pubmed","32053683","create date:2020/02/14 | first author:Dankiw KA",
"Is the bispectral index monitoring protective against postoperative cognitive decline? A systematic review with meta-analysis.","/pubmed/32053678","Bocskai T, Kovács M, Szakács Z, Gede N, Hegyi P, Varga G, Pap I, Tóth I, Révész P, Szanyi I, Németh A, Gerlinger I, Karádi K, Lujber L.","PLoS One. 2020 Feb 13;15(2):e0229018. doi: 10.1371/journal.pone.0229018. eCollection 2020.","PLoS One.  2020","PubMed","citation","PMID:32053678","pubmed","32053678","create date:2020/02/14 | first author:Bocskai T",
"Prognostic value of the myocardial salvage index measured by T2-weighted and T1-weighted late gadolinium enhancement magnetic resonance imaging after ST-segment elevation myocardial infarction: A systematic review and meta-regression analysis.","/pubmed/32053651","Kendziora B, Dewey M.","PLoS One. 2020 Feb 13;15(2):e0228736. doi: 10.1371/journal.pone.0228736. eCollection 2020.","PLoS One.  2020","PubMed","citation","PMID:32053651","pubmed","32053651","create date:2020/02/14 | first author:Kendziora B",
"The threshold of alpha-fetoprotein (AFP) for the diagnosis of hepatocellular carcinoma: A systematic review and meta-analysis.","/pubmed/32053643","Zhang J, Chen G, Zhang P, Zhang J, Li X, Gan D, Cao X, Han M, Du H, Ye Y.","PLoS One. 2020 Feb 13;15(2):e0228857. doi: 10.1371/journal.pone.0228857. eCollection 2020.","PLoS One.  2020","PubMed","citation","PMID:32053643","pubmed","32053643","create date:2020/02/14 | first author:Zhang J",
"Adherence to treatment for polycystic ovarian syndrome: A systematic review.","/pubmed/32053629","Parker M, Warren A, Nair S, Barnard M.","PLoS One. 2020 Feb 13;15(2):e0228586. doi: 10.1371/journal.pone.0228586. eCollection 2020.","PLoS One.  2020","PubMed","citation","PMID:32053629","pubmed","32053629","create date:2020/02/14 | first author:Parker M",
"The association between allergic rhinitis and sleep: A systematic review and meta-analysis of observational studies.","/pubmed/32053609","Liu J, Zhang X, Zhao Y, Wang Y.","PLoS One. 2020 Feb 13;15(2):e0228533. doi: 10.1371/journal.pone.0228533. eCollection 2020.","PLoS One.  2020","PubMed","citation","PMID:32053609","pubmed","32053609","create date:2020/02/14 | first author:Liu J",
"Guidelines for the Treatment of Latent Tuberculosis Infection: Recommendations from the National Tuberculosis Controllers Association and CDC, 2020.","/pubmed/32053584","Sterling TR, Njie G, Zenner D, Cohn DL, Reves R, Ahmed A, Menzies D, Horsburgh CR Jr, Crane CM, Burgos M, LoBue P, Winston CA, Belknap R.","MMWR Recomm Rep. 2020 Feb 14;69(1):1-11. doi: 10.15585/mmwr.rr6901a1.","MMWR Recomm Rep.  2020","PubMed","citation","PMID:32053584","pubmed","32053584","create date:2020/02/14 | first author:Sterling TR",
"Mucosa and Rejection in Facial Vascularized Composite Allotransplantation: A Systematic Review.","/pubmed/32053572","Kauke M, Safi AF, Zhegibe A, Haug V, Kollar B, Nelms L, Palmer WJ, Tchiloemba B, Lian CG, Murphy GF, Pomahac B.","Transplantation. 2020 Feb 12. doi: 10.1097/TP.0000000000003171. [Epub ahead of print]","Transplantation.  2020","PubMed","citation","PMID:32053572","pubmed","32053572","create date:2020/02/14 | first author:Kauke M",
"Prelinguistic Vocal Development in Children With Cochlear Implants: A Systematic Review.","/pubmed/32053545","McDaniel J, Gifford RH.","Ear Hear. 2020 Feb 12. doi: 10.1097/AUD.0000000000000829. [Epub ahead of print]","Ear Hear.  2020","PubMed","citation","PMID:32053545","pubmed","32053545","create date:2020/02/14 | first author:McDaniel J",
"Efficacy and Safety of Monoclonal Antibodies Against Clostridioides difficile Toxins for Prevention of Recurrent Clostridioides difficile Infection: A Systematic Review and Meta-Analysis.","/pubmed/32053529","Akiyama S, Yamada A, Komaki Y, Komaki F, Micic D, Sakuraba A.","J Clin Gastroenterol. 2020 Feb 12. doi: 10.1097/MCG.0000000000001330. [Epub ahead of print]","J Clin Gastroenterol.  2020","PubMed","citation","PMID:32053529","pubmed","32053529","create date:2020/02/14 | first author:Akiyama S",
"Disease-free survival as a measure of overall survival in resected pancreatic endocrine neoplasms.","/pubmed/32053492","Ricci C, Partelli S, Ingaldi C, Valentina A, Campana D, Muffati F, Alberici L, Giorgi C, Casadei R, Falconi M.","Endocr Relat Cancer. 2020 Feb 1. pii: ERC-19-0468. doi: 10.1530/ERC-19-0468. [Epub ahead of print]","Endocr Relat Cancer.  2020","PubMed","citation","PMID:32053492","pubmed","32053492","create date:2020/02/14 | first author:Ricci C",
"Do Tooth- and Cavity-related Aspects of Noncarious Cervical Lesions Affect the Retention of Resin Composite Restorations in Adults? A Systematic Review and Meta-analysis.","/pubmed/32053461","Correia A, Bresciani E, Borges AB, Pereira DM, Maia LC, Caneppele T.","Oper Dent. 2020 Feb 13. doi: 10.2341/19-091-L. [Epub ahead of print]","Oper Dent.  2020","PubMed","citation","PMID:32053461","pubmed","32053461","create date:2020/02/14 | first author:Correia A",
"Professional and interprofessional identities: a scoping review.","/pubmed/32053408","Tong R, Brewer M, Flavell H, Roberts LD.","J Interprof Care. 2020 Feb 13:1-9. doi: 10.1080/13561820.2020.1713063. [Epub ahead of print]","J Interprof Care.  2020","PubMed","citation","PMID:32053408","pubmed","32053408","create date:2020/02/14 | first author:Tong R",
"The safety of brodalumab for the treatment of psoriasis.","/pubmed/32053396","Puig L, Iznardo H.","Expert Opin Drug Saf. 2020 Feb 13. doi: 10.1080/14740338.2020.1730326. [Epub ahead of print]","Expert Opin Drug Saf.  2020","PubMed","citation","PMID:32053396","pubmed","32053396","create date:2020/02/14 | first author:Puig L",
"Health Literacy in Surgery.","/pubmed/32053207","Chang ME, Baker SJ, Dos Santos Marques IC, Liwo AN, Chung SK, Richman JS, Knight SJ, Fouad MN, Gakumo CA, Davis TC, Chu DI.","Health Lit Res Pract. 2020 Feb 11;4(1):e46-e65. doi: 10.3928/24748307-20191121-01.","Health Lit Res Pract.  2020","PubMed","citation","PMID:32053207","pubmed","32053207","create date:2020/02/14 | first author:Chang ME",
"Empirically Tested Health Literacy Frameworks.","/pubmed/32053206","Cudjoe J, Delva S, Cajita M, Han HR.","Health Lit Res Pract. 2020 Feb 11;4(1):e22-e44. doi: 10.3928/24748307-20191025-01.","Health Lit Res Pract.  2020","PubMed","citation","PMID:32053206","pubmed","32053206","create date:2020/02/14 | first author:Cudjoe J",
"Making Sense of ""Somatization"": A Systematic Review of its Relationship to Pediatric Pain.","/pubmed/32053181","Boerner KE, Green K, Chapman A, Stanford E, Newlove T, Edwards K, Dhariwal A.","J Pediatr Psychol. 2020 Feb 13. pii: jsz102. doi: 10.1093/jpepsy/jsz102. [Epub ahead of print]","J Pediatr Psychol.  2020","PubMed","citation","PMID:32053181","pubmed","32053181","create date:2020/02/14 | first author:Boerner KE",
"Actigraphy-Based Assessment of Sleep Parameters.","/pubmed/32053169","Fekedulegn D, Andrew ME, Shi M, Violanti JM, Knox S, Innes KE.","Ann Work Expo Health. 2020 Feb 13. pii: wxaa007. doi: 10.1093/annweh/wxaa007. [Epub ahead of print]","Ann Work Expo Health.  2020","PubMed","citation","PMID:32053169","pubmed","32053169","create date:2020/02/14 | first author:Fekedulegn D",
"About the need to make computational models of biological macromolecules available and discoverable.","/pubmed/32053168","Abriata LA, Lepore R, Dal Peraro M.","Bioinformatics. 2020 Feb 13. pii: btaa086. doi: 10.1093/bioinformatics/btaa086. [Epub ahead of print]","Bioinformatics.  2020","PubMed","citation","PMID:32053168","pubmed","32053168","create date:2020/02/14 | first author:Abriata LA",
"From ""Step Away"" to ""Stand Down"": Tailoring a Smartphone App for Self-Management of Hazardous Drinking for Veterans.","/pubmed/32053118","Blonigen D, Harris-Olenak B, Kuhn E, Humphreys K, Timko C, Dulin P.","JMIR Mhealth Uhealth. 2020 Feb 13;8(2):e16062. doi: 10.2196/16062.","JMIR Mhealth Uhealth.  2020","PubMed","citation","PMID:32053118","pubmed","32053118","create date:2020/02/14 | first author:Blonigen D",
"Emerging therapeutic targets for NASH: key innovations at the preclinical level.","/pubmed/32053033","Horn P, Newsome PN.","Expert Opin Ther Targets. 2020 Feb 13:1-12. doi: 10.1080/14728222.2020.1728742. [Epub ahead of print]","Expert Opin Ther Targets.  2020","PubMed","citation","PMID:32053033","pubmed","32053033","create date:2020/02/14 | first author:Horn P",
"The association between body weight dissatisfaction with unhealthy eating behaviors and lack of physical activity in adolescents: A systematic review.","/pubmed/32053022","Duarte LS, Palombo CNT, Solis-Cordero K, Kurihayashi AY, Steen M, Borges ALV, Fujimori E.","J Child Health Care. 2020 Feb 13:1367493520904914. doi: 10.1177/1367493520904914. [Epub ahead of print]","J Child Health Care.  2020","PubMed","citation","PMID:32053022","pubmed","32053022","create date:2020/02/14 | first author:Duarte LS",
"The Effects of Casual Videogames on Anxiety, Depression, Stress, and Low Mood: A Systematic Review.","/pubmed/32053021","Pine R, Fleming T, McCallum S, Sutcliffe K.","Games Health J. 2020 Feb 13. doi: 10.1089/g4h.2019.0132. [Epub ahead of print]","Games Health J.  2020","PubMed","citation","PMID:32053021","pubmed","32053021","create date:2020/02/14 | first author:Pine R",
"Summary of the clinical practice guideline for multicomponent behavioral treatment of obesity and overweight in children and adolescents.","/pubmed/32052993","Guideline Development Panel for Treatment of Obesity, American Psychological Association..","Am Psychol. 2020 Feb-Mar;75(2):178-188. doi: 10.1037/amp0000530.","Am Psychol.  2020","PubMed","citation","PMID:32052993","pubmed","32052993","create date:2020/02/14 | first author:Guideline Development Panel for Treatment of Obesity, American Psychological Association.",
"Development of achievement goals and their relation to academic interest and achievement in adolescence: A review of the literature and two longitudinal studies.","/pubmed/32052983","Scherrer V, Preckel F, Schmidt I, Elliot AJ.","Dev Psychol. 2020 Feb 13. doi: 10.1037/dev0000898. [Epub ahead of print]","Dev Psychol.  2020","PubMed","citation","PMID:32052983","pubmed","32052983","create date:2020/02/14 | first author:Scherrer V",
"Management of upper extremity aneurysms: a systematic review.","/pubmed/32052949","Kuntz S, Lejay A, Georg Y, Thaveau F, Chakfé N.","Int Angiol. 2020 Feb 12. doi: 10.23736/S0392-9590.20.04307-2. [Epub ahead of print]","Int Angiol.  2020","PubMed","citation","PMID:32052949","pubmed","32052949","create date:2020/02/14 | first author:Kuntz S",
"Association of the sinonasal bacterial microbiome with clinical outcomes in chronic rhinosinusitis: a systematic review.","/pubmed/32052920","Wang JC, Moore CA, Epperson MV, Sedaghat AR.","Int Forum Allergy Rhinol. 2020 Feb 13. doi: 10.1002/alr.22524. [Epub ahead of print]","Int Forum Allergy Rhinol.  2020","PubMed","citation","PMID:32052920","pubmed","32052920","create date:2020/02/14 | first author:Wang JC",
"A systematic review of hepatic arterial infusion chemotherapy versus sorafenib in patients with hepatocellular carcinoma with portal vein tumor thrombosis.","/pubmed/32052876","Liu M, Shi J, Mu T, Wang Y, Wu Z, Shen A.","J Gastroenterol Hepatol. 2020 Feb 13. doi: 10.1111/jgh.15010. [Epub ahead of print]","J Gastroenterol Hepatol.  2020","PubMed","citation","PMID:32052876","pubmed","32052876","create date:2020/02/14 | first author:Liu M",
"Interventions to increase adherence to micronutrient supplementation during pregnancy: a protocol for a systematic review.","/pubmed/32052867","Gomes F, Bergeron G, Bourassa MW, Dallmann D, Golan J, Hurley KM, King SE, da Silva ACF, Mehta S.","Ann N Y Acad Sci. 2020 Feb 13. doi: 10.1111/nyas.14319. [Epub ahead of print]","Ann N Y Acad Sci.  2020","PubMed","citation","PMID:32052867","pubmed","32052867","create date:2020/02/14 | first author:Gomes F",
"Serological assays for the diagnosis of Strongyloides stercoralis infection: a systematic review and meta-analysis of diagnostic test accuracy.","/pubmed/32052848","Kalantari N, Chehrazi M, Ghaffari S, Gorgani-Firouzjaee T.","Trans R Soc Trop Med Hyg. 2020 Feb 13. pii: trz135. doi: 10.1093/trstmh/trz135. [Epub ahead of print]","Trans R Soc Trop Med Hyg.  2020","PubMed","citation","PMID:32052848","pubmed","32052848","create date:2020/02/14 | first author:Kalantari N",
"Compensatory Interventions for Cognitive Impairments in Psychosis: A Systematic Review and Meta-Analysis.","/pubmed/32052837","Allott K, van-der-El K, Bryce S, Parrish EM, McGurk SR, Hetrick S, Bowie CR, Kidd S, Hamilton M, Killackey E, Velligan D.","Schizophr Bull. 2020 Feb 13. pii: sbz134. doi: 10.1093/schbul/sbz134. [Epub ahead of print]","Schizophr Bull.  2020","PubMed","citation","PMID:32052837","pubmed","32052837","create date:2020/02/14 | first author:Allott K",
"The impact of educational interventions on clinicians' knowledge of radiation protection: An integrative review.","/pubmed/32052790","Hankin RA, Jones SP.","Radiography (Lond). 2020 Feb 10. pii: S1078-8174(20)30009-2. doi: 10.1016/j.radi.2020.01.008. [Epub ahead of print] Review.","Radiography (Lond).  2020","PubMed","citation","PMID:32052790","pubmed","32052790","create date:2020/02/14 | first author:Hankin RA",
"A systematic review of incubator-based neonatal radiography - What does the evidence say?","/pubmed/32052784","Tugwell-Allsup J, England A.","Radiography (Lond). 2019 Oct 16. pii: S1078-8174(19)30147-6. doi: 10.1016/j.radi.2019.09.009. [Epub ahead of print] Review.","Radiography (Lond).  2019","PubMed","citation","PMID:32052784","pubmed","32052784","create date:2020/02/14 | first author:Tugwell-Allsup J",
"Ionising radiation exposure from medical imaging - A review of Patient's (un) awareness.","/pubmed/32052780","Ribeiro A, Husson O, Drey N, Murray I, May K, Thurston J, Oyen W.","Radiography (Lond). 2019 Oct 29. pii: S1078-8174(19)30151-8. doi: 10.1016/j.radi.2019.10.002. [Epub ahead of print]","Radiography (Lond).  2019","PubMed","citation","PMID:32052780","pubmed","32052780","create date:2020/02/14 | first author:Ribeiro A",
"Clinical practice guidelines for videofluoroscopic swallowing studies: A systematic review.","/pubmed/32052773","Boaden E, Nightingale J, Bradbury C, Hives L, Georgiou R.","Radiography (Lond). 2019 Nov 25. pii: S1078-8174(19)30160-9. doi: 10.1016/j.radi.2019.10.011. [Epub ahead of print]","Radiography (Lond).  2019","PubMed","citation","PMID:32052773","pubmed","32052773","create date:2020/02/14 | first author:Boaden E",
"The radiology impact of healthcare errors during shift work.","/pubmed/32052756","Elliott J, Williamson K.","Radiography (Lond). 2019 Dec 26. pii: S1078-8174(19)30272-X. doi: 10.1016/j.radi.2019.12.007. [Epub ahead of print] Review.","Radiography (Lond).  2019","PubMed","citation","PMID:32052756","pubmed","32052756","create date:2020/02/14 | first author:Elliott J",
"Anti-inflammatory and antioxidant therapies for Chagasic myocarditis: a systematic review.","/pubmed/32052721","Freitas DS, Silva Godinho AS, Mondêgo-Oliveira R, Cardoso FO, Abreu-Silva AL, Silva LA.","Parasitology. 2020 Feb 13:1-35. doi: 10.1017/S0031182020000153. [Epub ahead of print] No abstract available. ","Parasitology.  2020","PubMed","citation","PMID:32052721","pubmed","32052721","create date:2020/02/14 | first author:Freitas DS",
"The Burden of Respiratory Syncytial Virus in Adults: A Systematic Review and Meta-Analysis.","/pubmed/32052719","Tin Tin Htar M, Yerramalla MS, Moïsi JC, Swerdlow DL.","Epidemiol Infect. 2020 Feb 13:1-35. doi: 10.1017/S0950268820000400. [Epub ahead of print] No abstract available. ","Epidemiol Infect.  2020","PubMed","citation","PMID:32052719","pubmed","32052719","create date:2020/02/14 | first author:Tin Tin Htar M",
"Research Consent Models Used in Prospective Studies of Neurologically Deceased Organ Donors: A Systematic Review.","/pubmed/32052700","D'Aragon F, Burns KEA, Yaworski A, Lucas A, Arseneau E, Belley-Cote E, Dhanani S, Frenette AJ, Lamontagne F, Lauzier F, Akhtar A, Oczkowski S, Rochwerg B, Meade MO.","J Empir Res Hum Res Ethics. 2020 Feb 13:1556264620904627. doi: 10.1177/1556264620904627. [Epub ahead of print]","J Empir Res Hum Res Ethics.  2020","PubMed","citation","PMID:32052700","pubmed","32052700","create date:2020/02/14 | first author:D'Aragon F",
"Management of diabetic foot infections in the light of recent literature and new international guidelines.","/pubmed/32052672","Ertuğrul B, Uçkay İ, Schöni M, Peter-Riesch B, Lipsky BA.","Expert Rev Anti Infect Ther. 2020 Feb 13. doi: 10.1080/14787210.2020.1730177. [Epub ahead of print]","Expert Rev Anti Infect Ther.  2020","PubMed","citation","PMID:32052672","pubmed","32052672","create date:2020/02/14 | first author:Ertuğrul B",
"Intranasal Glucagon: A New Way to Treat Hypoglycemic Emergencies.","/pubmed/32052651","Lowe RN, Trujillo JM.","Ann Pharmacother. 2020 Feb 13:1060028020905846. doi: 10.1177/1060028020905846. [Epub ahead of print]","Ann Pharmacother.  2020","PubMed","citation","PMID:32052651","pubmed","32052651","create date:2020/02/14 | first author:Lowe RN",
"Sequelae in permanent teeth after traumatic injuries to primary dentition.","/pubmed/32052622","La Monaca G, Pranno N, Vozza I, Annibali S, Polimeni A, Bossù M, Cristalli MP.","Minerva Stomatol. 2019 Dec;68(6):332-340. doi: 10.23736/S0026-4970.19.04297-3.","Minerva Stomatol.  2019","PubMed","citation","PMID:32052622","pubmed","32052622","create date:2020/02/14 | first author:La Monaca G",
"Fear and anxiety managing methods during dental treatments: a systematic review of recent data.","/pubmed/32052621","De Stefano R, Bruno A, Muscatello MR, Cedro C, Cervino G, Fiorillo L.","Minerva Stomatol. 2019 Dec;68(6):317-331. doi: 10.23736/S0026-4970.19.04288-2.","Minerva Stomatol.  2019","PubMed","citation","PMID:32052621","pubmed","32052621","create date:2020/02/14 | first author:De Stefano R",
"Surgical fenestrated approach to the maxillary sinus like alternative to Caldwell-Luc technique.","/pubmed/32052620","Manfredi M, Fabbri C, Gessaroli M, Morolli F, Stacchini M.","Minerva Stomatol. 2019 Dec;68(6):308-316. doi: 10.23736/S0026-4970.19.04255-9.","Minerva Stomatol.  2019","PubMed","citation","PMID:32052620","pubmed","32052620","create date:2020/02/14 | first author:Manfredi M",
"DYSPNOEA ASSESSMENT IN ADULTS WITH END-STAGE KIDNEY DISEASE: A SYSTEMATIC REVIEW.","/pubmed/32052590","Chilvers M, Johnston K, Ferrar K, Williams MT.","J Ren Care. 2020 Feb 12. doi: 10.1111/jorc.12321. [Epub ahead of print]","J Ren Care.  2020","PubMed","citation","PMID:32052590","pubmed","32052590","create date:2020/02/14 | first author:Chilvers M",
"Household food insecurity and early childhood development: Systematic review and meta-analysis.","/pubmed/32052571","de Oliveira KHD, de Almeida GM, Gubert MB, Moura AS, Spaniol AM, Hernandez DC, Pérez-Escamilla R, Buccini G.","Matern Child Nutr. 2020 Feb 12:e12967. doi: 10.1111/mcn.12967. [Epub ahead of print] Review.","Matern Child Nutr.  2020","PubMed","citation","PMID:32052571","pubmed","32052571","create date:2020/02/14 | first author:de Oliveira KHD",
"Transcutaneous vagus nerve stimulation for the treatment of drug-resistant epilepsy: a meta-analysis and systematic review.","/pubmed/32052569","Wu K, Wang Z, Zhang Y, Yao J, Zhang Z.","ANZ J Surg. 2020 Feb 12. doi: 10.1111/ans.15681. [Epub ahead of print] Review.","ANZ J Surg.  2020","PubMed","citation","PMID:32052569","pubmed","32052569","create date:2020/02/14 | first author:Wu K",
"Health information seeking behaviour: a concept analysis.","/pubmed/32052549","Zimmerman MS, Shaw G Jr.","Health Info Libr J. 2020 Feb 12. doi: 10.1111/hir.12287. [Epub ahead of print] Review.","Health Info Libr J.  2020","PubMed","citation","PMID:32052549","pubmed","32052549","create date:2020/02/14 | first author:Zimmerman MS",
"The utility of pre-operative radiological evaluation of early rectal neoplasia: a systematic review and meta-analysis.","/pubmed/32052545","O'Connell E, Galvin R, McNamara DA, Burke JP.","Colorectal Dis. 2020 Feb 12. doi: 10.1111/codi.15015. [Epub ahead of print] Review.","Colorectal Dis.  2020","PubMed","citation","PMID:32052545","pubmed","32052545","create date:2020/02/14 | first author:O'Connell E",
"Prevalence of type II workplace violence among home healthcare workers: A meta-analysis.","/pubmed/32052510","Byon HD, Lee M, Choi M, Sagherian K, Crandall M, Lipscomb J.","Am J Ind Med. 2020 Feb 12. doi: 10.1002/ajim.23095. [Epub ahead of print] Review.","Am J Ind Med.  2020","PubMed","citation","PMID:32052510","pubmed","32052510","create date:2020/02/14 | first author:Byon HD",
"Dynamic features of placebo effects addressing persistent insomnia disorder: A meta-analysis of placebo-controlled randomized clinical trials.","/pubmed/32052501","Jiang B, He D, Guo Z, Gao Z.","J Sleep Res. 2020 Feb 12:e12997. doi: 10.1111/jsr.12997. [Epub ahead of print]","J Sleep Res.  2020","PubMed","citation","PMID:32052501","pubmed","32052501","create date:2020/02/14 | first author:Jiang B",
"Stevens-Johnson syndrome and toxic epidermal necrolysis-like reactions to checkpoint inhibitors: a systematic review.","/pubmed/32052409","Maloney NJ, Ravi V, Cheng K, Bach DQ, Worswick S.","Int J Dermatol. 2020 Feb 13. doi: 10.1111/ijd.14811. [Epub ahead of print] Review.","Int J Dermatol.  2020","PubMed","citation","PMID:32052409","pubmed","32052409","create date:2020/02/14 | first author:Maloney NJ",
"Comparison of Magnetic Resonance Imaging and Contrast-Enhanced Ultrasound as Diagnostic Options for Unclear Cystic Renal Lesions: A Cost-Effectiveness Analysis.","/pubmed/32052386","Gassert F, Schnitzer M, Kim SH, Kunz WG, Ernst BP, Clevert DA, Nörenberg D, Rübenthaler J, Froelich MF.","Ultraschall Med. 2020 Feb 12. doi: 10.1055/a-1110-7172. [Epub ahead of print]","Ultraschall Med.  2020","PubMed","citation","PMID:32052386","pubmed","32052386","create date:2020/02/14 | first author:Gassert F",
"Review of concepts in therapeutic decision-making in HER2-negative luminal metastatic breast cancer.","/pubmed/32052382","Alvarez-Lopez I, Bezares S, Dalmau Portulas E, García-Martínez E, García-Sáenz JÁ, Gil-Gil M, Martínez de Dueñas E, Ribelles N, Santaballa Bertrán A.","Clin Transl Oncol. 2020 Feb 12. doi: 10.1007/s12094-019-02269-7. [Epub ahead of print] Review.","Clin Transl Oncol.  2020","PubMed","citation","PMID:32052382","pubmed","32052382","create date:2020/02/14 | first author:Alvarez-Lopez I",
"Systematic Literature Review of Economic Evaluations of Biological Treatment Sequences for Patients with Moderate to Severe Rheumatoid Arthritis Previously Treated with Disease-Modifying Anti-rheumatic Drugs.","/pubmed/32052376","Ghabri S, Lam L, Bocquet F, Spath HM.","Pharmacoeconomics. 2020 Feb 13. doi: 10.1007/s40273-020-00887-6. [Epub ahead of print] Review.","Pharmacoeconomics.  2020","PubMed","citation","PMID:32052376","pubmed","32052376","create date:2020/02/14 | first author:Ghabri S",
"Etiology and therapeutic management of neonatal jaundice in Iran: a systematic review and meta-analysis.","/pubmed/32052364","Zahed Pasha Y, Alizadeh-Tabari S, Zahed Pasha E, Zamani M.","World J Pediatr. 2020 Feb 12. doi: 10.1007/s12519-020-00339-3. [Epub ahead of print] Review.","World J Pediatr.  2020","PubMed","citation","PMID:32052364","pubmed","32052364","create date:2020/02/14 | first author:Zahed Pasha Y",
"DOAC compared to LMWH in the treatment of cancer related-venous thromboembolism: a systematic review and meta-analysis.","/pubmed/32052314","Mai V, Tanguay VF, Guay CA, Bertoletti L, Magnan S, Turgeon AF, Lacasse Y, Lega JC, Provencher S.","J Thromb Thrombolysis. 2020 Feb 12. doi: 10.1007/s11239-020-02055-1. [Epub ahead of print]","J Thromb Thrombolysis.  2020","PubMed","citation","PMID:32052314","pubmed","32052314","create date:2020/02/14 | first author:Mai V",
